{
  "schema_version": "1.0.0",
  "contract_type": "ObservationEvent",
  "workflow_id": "wf_01",
  "correlation_id": "corr_01",
  "causation_id": "evt_10",
  "timestamp_utc": "2026-04-08T10:21:00Z",
  "originator": {
    "type": "tool",
    "id": "market_data_mcp"
  },
  "environment": "paper",
  "operating_mode": "MODE-001",
  "payload": {
    "observation_id": "obs_01",
    "observation_type": "market_snapshot",
    "severity": "info",
    "source": "market_data_mcp",
    "payload_ref_or_inline": {
      "snapshot_ref": "mktsnap_01"
    },
    "authority_state": {
      "authority": "broker_derived"
    },
    "freshness_status": "fresh",
    "observed_at": "2026-04-08T10:20:59Z"
  }
}
